<?xml version="1.0" encoding="UTF-8" ?>
<Gendata xmlns:xsi="http://www.w3.org/2001/XMLSchema-instance"
         xsi:schemaLocation="http://by/it/malyshev/jd02_07/gendata Gendata.xsd"
         xmlns="http://by/it/malyshev/jd02_07/gendata"
>
    <Person kit="N22223">
        <Name>Archibald Volf</Name>
        <Ancestor>Adam Volf</Ancestor>
        <Country>Switzerland</Country>
        <Geocoord>
            <Latitude>46.9983</Latitude>
            <Longitude>7.4513</Longitude>
        </Geocoord>
        <Haplotype>
            <STRmarkers>
                <DYS393>12</DYS393>
                <DYS390>24</DYS390>
                <DYS19>14</DYS19>
                <DYS391>12</DYS391>
                <DYS385a>12</DYS385a>
                <DYS385b>15</DYS385b>
                <DYS426>12</DYS426>
                <DYS388>12</DYS388>
                <DYS439>13</DYS439>
                <DYS389i>14</DYS389i>
                <DYS392>13</DYS392>
                <DYS389ii>30</DYS389ii>
            </STRmarkers>
        </Haplotype>
    </Person>
</Gendata>